A1: opt_code | B1: opt_name | C1: del_flag | D1: reserve1 | E1: reserve2 | F1: reserve3 | G1: upd_flag | H1: upd_time
A2: 20765 | B2: 商易通/助农通转账
A3: 20766 | B3: 外设类型
A4: 20768 | B4: 外设品牌
A5: 20769 | B5: 申请事项

A1: subopt_code | B1: subopt_name | C1: opt_code | D1: disp_seq | E1: upd_time | F1: del_flag | G1: reserve1 | H1: reserve2 | I1: reserve3 | J1: grouping_code | K1: upd_flag
A2: 01 | B2: ICC_IC读卡器 | C2: 20766 | E2: 43319.46769675926 | F2: 0 | G2: 0 | J2: =CONCATENATE(C2,"_",A2) -> 20766_01
A3: 02 | B3: MSG_磁条卡读写器 | C3: 20766 | E3: 43319.46769675926 | F3: 0 | G3: 0 | J3: =CONCATENATE(C3,"_",A3) -> 20766_02
A4: 03 | B4: PIN_非国密密码键盘 | C4: 20766 | E4: 43319.46769675926 | F4: 0 | G4: 0 | J4: =CONCATENATE(C4,"_",A4) -> 20766_03
A5: 04 | B5: PIN_国密密码键盘 | C5: 20766 | E5: 43319.46769675926 | F5: 0 | G5: 0 | J5: =CONCATENATE(C5,"_",A5) -> 20766_04
A6: 05 | B6: MPN_柜外清 | C6: 20766 | E6: 43319.46769675926 | F6: 0 | G6: 0 | J6: =CONCATENATE(C6,"_",A6) -> 20766_05
A7: 06 | B7: IDD_身份证阅读器 | C7: 20766 | E7: 43319.46769675926 | F7: 0 | G7: 0 | J7: =CONCATENATE(C7,"_",A7) -> 20766_06
A8: 07 | B8: FNG_指纹仪 | C8: 20766 | E8: 43319.46769675926 | F8: 0 | G8: 0 | J8: =CONCATENATE(C8,"_",A8) -> 20766_07
A9: 08 | B9: PRT_打印机 | C9: 20766 | E9: 43319.46769675926 | F9: 0 | G9: 0 | J9: =CONCATENATE(C9,"_",A9) -> 20766_08

A1: subopt_code | B1: subopt_name | C1: opt_code | D1: disp_seq | E1: upd_time | F1: del_flag | G1: reserve1 | H1: reserve2 | I1: reserve3 | J1: grouping_code | K1: upd_flag
A2: 01 | B2: CENT_升腾 | C2: 20766_01 | E2: 43319.46769675926 | F2: 0 | G2: 0 | J2: =CONCATENATE(C2,"_",A2) -> 20766_01_01
A3: 02 | B3: CINC_中航 | C3: 20766_01 | E3: 43319.46769675926 | F3: 0 | G3: 0 | J3: =CONCATENATE(C3,"_",A3) -> 20766_01_02
A4: 03 | B4: DASC_得实 | C4: 20766_01 | E4: 43319.46769675926 | F4: 0 | G4: 0 | J4: =CONCATENATE(C4,"_",A4) -> 20766_01_03
A5: 04 | B5: GUOG_国光 | C5: 20766_01 | E5: 43319.46769675926 | F5: 0 | G5: 0 | J5: =CONCATENATE(C5,"_",A5) -> 20766_01_04
A6: 05 | B6: HJIA_禾嘉 | C6: 20766_01 | E6: 43319.46769675926 | F6: 0 | G6: 0 | J6: =CONCATENATE(C6,"_",A6) -> 20766_01_05
A7: 06 | B7: INVS_因纳伟盛 | C7: 20766_01 | E7: 43319.46769675926 | F7: 0 | G7: 0 | J7: =CONCATENATE(C7,"_",A7) -> 20766_01_06
A8: 07 | B8: JINC_金诚信 | C8: 20766_01 | E8: 43319.46769675926 | F8: 0 | G8: 0 | J8: =CONCATENATE(C8,"_",A8) -> 20766_01_07
A9: 08 | B9: NANT_南天 | C9: 20766_01 | E9: 43319.46769675926 | F9: 0 | G9: 0 | J9: =CONCATENATE(C9,"_",A9) -> 20766_01_08
A10: 09 | B10: SDSS_神思 | C10: 20766_01 | E10: 43319.46769675926 | F10: 0 | G10: 0 | J10: =CONCATENATE(C10,"_",A10) -> 20766_01_09
A11: 10 | B11: SDTJ_时代天鉴 | C11: 20766_01 | E11: 43319.46769675926 | F11: 0 | G11: 0 | J11: =CONCATENATE(C11,"_",A11) -> 20766_01_10
A12: 11 | B12: STAR_实达 | C12: 20766_01 | E12: 43319.46769675926 | F12: 0 | G12: 0 | J12: =CONCATENATE(C12,"_",A12) -> 20766_01_11
A13: 12 | B13: STON_四通 | C13: 20766_01 | E13: 43319.46769675926 | F13: 0 | G13: 0 | J13: =CONCATENATE(C13,"_",A13) -> 20766_01_12
A14: 13 | B14: SZHS_深圳华视 | C14: 20766_01 | E14: 43319.46769675926 | F14: 0 | G14: 0 | J14: =CONCATENATE(C14,"_",A14) -> 20766_01_13
A15: 14 | B15: TESO_天诚盛业 | C15: 20766_01 | E15: 43319.46769675926 | F15: 0 | G15: 0 | J15: =CONCATENATE(C15,"_",A15) -> 20766_01_14
A16: 15 | B16: ZLZK_中联智科 | C16: 20766_01 | E16: 43319.46769675926 | F16: 0 | G16: 0 | J16: =CONCATENATE(C16,"_",A16) -> 20766_01_15

A1: subopt_code | B1: subopt_name | C1: opt_code | D1: disp_seq | E1: upd_time | F1: del_flag | G1: reserve1 | H1: reserve2 | I1: reserve3 | J1: grouping_code | K1: upd_flag
A2: 01 | B2: 型号1 | C2: 20766_01_01 | E2: 43319.46769675926 | F2: 0 | G2: 0 | J2: =CONCATENATE(C2,"_",A2) -> 20766_01_01_01
A3: 02 | B3: 型号2 | C3: 20766_01_01 | E3: 43319.46769675926 | F3: 0 | G3: 0 | J3: =CONCATENATE(C3,"_",A3) -> 20766_01_01_02
A4: 03 | B4: 型号3 | C4: 20766_01_01 | E4: 43319.46769675926 | F4: 0 | G4: 0 | J4: =CONCATENATE(C4,"_",A4) -> 20766_01_01_03
A5: 04 | B5: 型号4 | C5: 20766_01_01 | E5: 43319.46769675926 | F5: 0 | G5: 0 | J5: =CONCATENATE(C5,"_",A5) -> 20766_01_01_04
A6: 05 | B6: 型号5 | C6: 20766_01_01 | E6: 43319.46769675926 | F6: 0 | G6: 0 | J6: =CONCATENATE(C6,"_",A6) -> 20766_01_01_05
A7: 06 | B7: 型号6 | C7: 20766_01_01 | E7: 43319.46769675926 | F7: 0 | G7: 0 | J7: =CONCATENATE(C7,"_",A7) -> 20766_01_01_06